{
  "$schema": "../schema/carte.schema.json",
  "id": "modele-mondial-et-modes-de-comportement",
  "slug": "modele-mondial-et-modes-de-comportement",
  "status": "CANDIDATE",
  "title": "Modèle du monde et modes de comportement",
  "themes": [
    "croissance-et-limites"
  ],
  "theme_labels": {
    "croissance-et-limites": "Quand la croissance rencontre sa limite"
  },
  "domain": "systems-thinking",
  "authors": [
    {
      "name": "Donella H. Meadows",
      "app_author_id": null
    },
    {
      "name": "Dennis L. Meadows",
      "app_author_id": null
    },
    {
      "name": "Jørgen Randers",
      "app_author_id": null
    },
    {
      "name": "William W. Behrens III",
      "app_author_id": null
    }
  ],
  "attribution_note": "Concept coécrit par Donella H. Meadows, Dennis L. Meadows, Jørgen Randers et William W. Behrens III, les quatre noms de la page de titre. Leur modèle est bâti sur un prototype de Jay W. Forrester (World Dynamics, 1971). Le Club de Rome a commandité l'étude, il ne l'a pas écrite.",
  "hook": "Que peut dire un modèle du monde qui ne prédit aucun chiffre ?",
  "summary": "Meadows et ses coauteurs : leur modèle ne donne pas de valeur datée, mais les tendances de comportement que sa structure de boucles commande plus que les nombres.",
  "quotation": {
    "text": "Ces graphiques ne sont pas des prédictions exactes de la valeur des variables pour telle ou telle année à venir.",
    "reference": "Donella H. Meadows, Dennis L. Meadows, Jørgen Randers, William W. Behrens III, The Limits to Growth, New York, Universe Books, 1972.",
    "locator": "p. 93",
    "language": "fr",
    "original_text": "These graphs are not exact predictions of the values of the variables at any particular year in the future.",
    "original_language": "en",
    "translation": {
      "kind": "in-house",
      "translator": "Traduction interne non publiée (chaîne Curiosity, 5 septembre 2026). Aucune coupe. Dans l'original, « not » est composé en italique par l'imprimeur ; le français porte la négation sans l'italique. La phrase qui suit immédiatement dans le livre, « They are indications of the system's behavioral tendencies only. », n'est pas affichée : c'est le résumé qui la tient. La traduction française publiée, Halte à la croissance ?, Fayard, 1972, par Jacques Delaunay, n'a pas été ouverte.",
      "edition": null
    }
  },
  "sources": [
    {
      "label": "Donella H. Meadows, Dennis L. Meadows, Jørgen Randers, William W. Behrens III, The Limits to Growth, New York, Universe Books, 1972, 205 p. Cinquième tirage de la première édition, numérisé par le Donella Meadows Project.",
      "kind": "primary",
      "locator": "p. 20-24, 91-94, 121-122, 141-145",
      "doi_isbn": "ISBN 0-87663-165-0",
      "url": "https://donellameadows.org/wp-content/userfiles/Limits-to-Growth-digital-scan-version.pdf",
      "consulted": "full-text"
    },
    {
      "label": "The Limits to Growth, transcription diplomatique de l'édition de 1972 avec marqueurs de page, Dartmouth College Library.",
      "kind": "primary",
      "locator": "Marqueur « Page 93 »",
      "url": "https://collections.dartmouth.edu/archive/text/meadows/diplomatic/meadows_ltg-diplomatic.html",
      "consulted": "partial"
    },
    {
      "label": "Gaya Herrington, « Update to limits to growth: Comparing the World3 model with empirical data », Journal of Industrial Ecology, vol. 25, n° 3, 2021, p. 614-626.",
      "kind": "secondary-academic",
      "locator": "§1.2 et §1.4",
      "doi_isbn": "10.1111/jiec.13084",
      "url": "https://doi.org/10.1111/jiec.13084",
      "consulted": "full-text"
    },
    {
      "label": "Graham Turner, A Comparison of the Limits to Growth with Thirty Years of Reality, CSIRO Working Paper Series 2008-09, juin 2008, 52 p.",
      "kind": "secondary-academic",
      "locator": "Résumé et introduction",
      "doi_isbn": "RePEc:cse:wpaper:2008-09",
      "url": "https://www.ecsim.org/Vista/archivos/TURNER%20G%20-%20TLG%2030%20years%20comparison%20to%20reality.pdf",
      "consulted": "full-text"
    },
    {
      "label": "Jørgen Randers, « Le point de vue d'un co-auteur : Que nous disait réellement Halte à la croissance ? », Mondes en décroissance, n° 1, 2023.",
      "kind": "francophone-reception",
      "doi_isbn": "10.52497/revue-opcd.230",
      "url": "https://polen.uca.fr/revue-opcd/index.php?id=230",
      "consulted": "full-text"
    }
  ],
  "review": {
    "verdict": "PENDING",
    "notes": []
  },
  "notes": [
    "La citation est négative : elle dit ce que les graphiques ne sont pas. La contrepartie positive est portée par le résumé, faute de quoi la carte laisserait croire que les auteurs ne prétendent rien, ce qui est le contresens symétrique. Elle est dans le livre : « They are indications of the system's behavioral tendencies only. » (p. 93), et « In this first simple world model, we are interested only in the broad behavior modes of the population-capital system. » (p. 91).",
    "Le second membre du résumé s'appuie sur la page 121 : « the model's feedback loop structure is a much more important determinant of overall behavior than the exact numbers used to quantify the feedback loops. Even rather large changes in input data do not generally alter the mode of behavior. » Le résumé écrit « commande plus que les nombres » et non « détermine », pour rester sur le comparatif du texte.",
    "Le nom « World3 » n'est pas dans l'ouvrage de 1972 : zéro occurrence sur les 211 feuillets du scan, le livre dit « our world model » et « this first simple world model ». Le mot n'apparaît sur aucun champ rédigé de cette carte ; il figure dans la notice de Herrington (2021) parce que c'est le titre exact de son article.",
    "Édition : l'exemplaire ouvert est le cinquième tirage de la première édition de 1972. Les éditions de 1974, 1992 et 2004 n'ont pas été ouvertes. Herrington (2021) travaille sur World3-03, version révisée de 2004, et Turner (2008) sur les sorties de 1974 : leurs scénarios ne sont pas, ligne pour ligne, les figures lues ici. Ces deux sources ne fondent que le point commun aux trois états, à savoir que les scénarios n'étaient pas des prédictions.",
    "Localisations données en folios imprimés, relus sur image, jamais en numéros de feuillet du scan : la correspondance n'y est pas constante (feuillet = folio + 2 jusqu'à la page 102, folio + 1 à partir de 104).",
    "Le rapport technique auquel le livre renvoie p. 23 pour les équations n'a pas été ouvert. Aucune affirmation de cette carte ne porte sur ce niveau de détail.",
    "Nombre de scénarios : non compté sur le volume. Randers (2023) et Herrington (2021) écrivent que le livre en contient douze ; ce chiffre n'est repris nulle part sur la carte.",
    "La traduction française publiée chez Fayard (1972, Jacques Delaunay) n'a pas été ouverte et n'est pas portée en source ici, faute de place dans les cinq ; sa notice BnF est ark:/12148/cb36648670t. La critique économique contemporaine, Nordhaus (1973, DOI 10.2307/2230846), a été résolue mais non ouverte, et rien n'en est repris."
  ]
}
