{
  "$schema": "../schema/carte.schema.json",
  "id": "division-sexuelle-et-rapports-de-sexe",
  "slug": "division-sexuelle-et-rapports-de-sexe",
  "status": "VALIDATED",
  "title": "Division sexuelle du travail comme enjeu",
  "themes": [
    "division-sexuelle-du-travail"
  ],
  "domain": "sociology-of-work",
  "theme_labels": {
    "division-sexuelle-du-travail": "Division du travail et rapports de sexe"
  },
  "authors": [
    {
      "name": "Danièle Kergoat",
      "app_author_id": null
    }
  ],
  "attribution_note": "Le texte est signé du seul nom de Danièle Kergoat. Hélène Le Doaré y est nommée dès la première phrase comme celle avec qui ont été tenues les deux séances de séminaire dont ce papier est issu, et la proposition de poser les problèmes en termes de continuité ou de discontinuité lui est explicitement attribuée page 24 ; mais Kergoat précise à la même page qu'elle ne parle plus qu'en son nom propre, et la proposition citée ici est la sienne. Une note liminaire indique que le texte présenté date de juin 1990, alors que la livraison où il paraît porte le millésime 1992.",
  "quotation": {
    "text": "La division (sexuelle) du travail est un enjeu fondamental des rapports sociaux (entre les sexes).",
    "reference": "Danièle Kergoat, « Des rapports sociaux de sexe et de la division sexuelle du travail », Cahiers du GEDISST, n° 3, 1992, p. 23-26 ; phrase conclusive de la section « Une proposition de travail ».",
    "locator": "p. 25",
    "language": "fr",
    "original_text": null,
    "original_language": null,
    "translation": {
      "kind": "none",
      "translator": null,
      "edition": null
    }
  },
  "hook": "La division sexuelle du travail décrit-elle les rapports de sexe ou s'y joue-t-elle ?",
  "summary": "Les rapports sociaux organisent les divisions de la société ; la division sexuelle du travail en est un enjeu fondamental, et la chaîne se lit dans les deux sens.",
  "sources": [
    {
      "label": "Danièle Kergoat, « Des rapports sociaux de sexe et de la division sexuelle du travail », Cahiers du GEDISST, n° 3, 1992, p. 23-26.",
      "kind": "primary",
      "locator": "p. 23-26, ici p. 25",
      "doi_isbn": null,
      "url": "https://www.persee.fr/doc/genre_1165-3558_1992_num_3_1_879",
      "consulted": "full-text"
    }
  ],
  "review": {
    "reviewer": "contrôle aveugle, session du 27 août 2026",
    "date": "2026-08-27",
    "attribution": "confirmee",
    "quotation": "verbatim",
    "sources": "resolvent",
    "prose": "fidele",
    "verdict": "PASS",
    "rounds": 2,
    "notes": []
  },
  "notes": [
    "Aucune source secondaire n'a été ouverte sur cette fiche : la lecture repose entièrement sur le texte primaire, quatre pages consultées en texte intégral. L'absence de commentaire tiers est déclarée telle quelle, elle n'a pas été suppléée.",
    "Correction apportée par la lecture, et que le résumé porte : Kergoat ne fait pas de la division sexuelle du travail une forme du rapport social de sexe, elle en fait son enjeu. La chaîne rapports sociaux de sexe, division sexuelle du travail comme enjeu, pratiques sociales est dite réversible : elle permet de penser tant la reproduction des rapports sociaux que leur remise en cause. C'est ce que rend « la chaîne se lit dans les deux sens ».",
    "Précisions de l'auteure qu'un résumé de 170 caractères ne peut pas porter : rapport social ne veut dire ni relation sociale ni interaction, mais antagonisme et contradiction s'exprimant conjointement à la mise en place d'une hiérarchisation ; et en parlant de division du travail on ne se situe pas dans le paradigme durkheimien d'une société solidaire. Les rapports sociaux sont dits consubstanciels les uns aux autres, ou, postulat minimum, coextensifs.",
    "La citation a été repérée sur l'OCR de Persée puis relue caractère par caractère sur l'image de la page 25 : elle est verbatim, sans coupe, parenthèses de l'auteure comprises.",
    "Le texte se donne lui-même comme daté : la note liminaire de la page 23 avertit qu'il date de juin 1990 et que certaines idées avancées n'ont pas été reprises ultérieurement, l'auteure ayant choisi de laisser le papier en l'état. La carte vaut donc pour cet état de la réflexion, non pour l'ensemble de l'œuvre de Kergoat, où la thèse de la consubstantialité a été reformulée plus tard.",
    "Correction de tour 1, sources : le titre de revue portait Les Cahiers du Genre, qui est le titre postérieur de la même revue. La livraison de 1992 s'appelle Cahiers du GEDISST, comme l'attestent la notice Persée et la note 1 de la page 23, où l'article se cite lui-même ainsi (« Cahier du Gedisst, n° 2, 1991 »). Corrigé dans le label de la source primaire et dans la reference de la citation. L'URL Persée est inchangée et résout.",
    "Le numéro et le volume proviennent de la notice Persée et non de la pièce, dont seules les pages de texte ont été vues.",
    "Correction de tour 1, prose : le résumé écrivait que la division sexuelle du travail est « l'enjeu fondamental » des « rapports sociaux de sexe ». Deux écarts corrigés. Kergoat oppose à trois lignes d'écart, page 25, « les modalités matérielles de ces (bi-)catégorisations sont donc l'enjeu des rapports sociaux » (en gras dans l'imprimé) et « la division (sexuelle) du travail est un enjeu fondamental » : l'article indéfini est marqué, la division sexuelle du travail est un enjeu parmi d'autres, seule lecture compatible avec la consubstantialité affirmée juste au-dessus. Et ce que le texte énonce vaut des rapports sociaux tout court, ses exemples n'étant pas sexués (privé/public, manuel/intellectuel, capital/travail, division internationale du travail) ; la spécification au sexe ne vient qu'ensuite, par ses parenthèses. L'accroche et « la chaîne se lit dans les deux sens » sont maintenues.",
    "Le PDF de Persée répond 403 ; ce filtrage n'a pas été contourné."
  ]
}