{
  "$schema": "../schema/carte.schema.json",
  "id": "approche-axiomatique-arrow-raynaud",
  "slug": "approche-axiomatique-arrow-raynaud",
  "status": "CANDIDATE",
  "title": "L'approche axiomatique Arrow-Raynaud",
  "themes": [
    "instruire-un-arbitrage"
  ],
  "theme_labels": {
    "instruire-un-arbitrage": "Aider quelqu'un à trancher"
  },
  "authors": [
    {
      "name": "Kenneth J. Arrow",
      "app_author_id": null
    },
    {
      "name": "Hervé Raynaud",
      "app_author_id": null
    }
  ],
  "attribution_note": "L'article est signé « par Jacques Pasquier-Dorthe et Hervé Raynaud » (p. 11). L'approche qu'il présente n'est pourtant pas attribuée par lui à ses deux signataires : elle y est dite « le fruit d'une longue collaboration entre Kenneth Arrow et Hervé Raynaud », et le texte parle d'Arrow et de Raynaud à la troisième personne d'un bout à l'autre alors même que Raynaud le cosigne (« H. Raynaud a démontré les théorèmes suivants », p. 16 ; « Arrow et Raynaud, dans leur approche, proposent », p. 17). Jacques Pasquier-Dorthe cosigne donc la présentation en français, et aucun résultat ne lui est attribué dans l'article. 1995 est le millésime de l'article et non celui de l'approche, que le texte dit antérieure de quelques années sans jamais la dater. La cosignature d'Arrow et de Raynaud est attestée hors de ce texte par leur ouvrage commun de 1986, qui n'a pas été ouvert.",
  "hook": "Chaque méthode multicritère est la recette de son auteur : comment choisir ?",
  "summary": "Une méthode multicritère se choisit sur ses propriétés logiques, les axiomes qu'elle vérifie : aucun système d'axiomes unique ne convient à tous les problèmes.",
  "quotation": {
    "text": "On entend par axiome toute propriété logique que doit vérifier une méthode choisie par le décideur.",
    "reference": "Jacques Pasquier-Dorthe et Hervé Raynaud, « Un outil d'aide à la décision multicritère », Revue française de gestion, n° 106, novembre-décembre 1995, p. 11-21.",
    "locator": "p. 13, première colonne, fin de la section I",
    "language": "fr",
    "original_text": null,
    "original_language": null,
    "translation": {
      "kind": "none",
      "translator": null,
      "edition": null
    }
  },
  "sources": [
    {
      "label": "Jacques Pasquier-Dorthe et Hervé Raynaud, « Un outil d'aide à la décision multicritère », Revue française de gestion, n° 106, novembre-décembre 1995, p. 11-21. Fac-similé Persée.",
      "kind": "primary",
      "locator": "p. 11-21",
      "doi_isbn": null,
      "url": "https://www.persee.fr/doc/rfg_0338-4551_1995_num_106_1_6849",
      "consulted": "full-text"
    },
    {
      "label": "Kenneth J. Arrow et Hervé Raynaud, Social Choice and Multicriterion Decision-Making, Cambridge (Mass.), The MIT Press, 1986, vii-127 p.",
      "kind": "primary",
      "locator": null,
      "doi_isbn": "ISBN 0-262-01087-9",
      "url": "https://openlibrary.org/books/OL2538942M",
      "consulted": "metadata-only"
    },
    {
      "label": "Hervé Raynaud, Logique de la décision managériale, avec la collaboration de Kenneth J. Arrow, Paris, Hermès science publications-Lavoisier, collection Recherche opérationnelle, 2011, 448 p.",
      "kind": "primary",
      "locator": null,
      "doi_isbn": "ISBN 978-2-7462-3190-0",
      "url": "https://catalogue.bnf.fr/ark:/12148/cb42407853x",
      "consulted": "metadata-only"
    }
  ],
  "review": {
    "verdict": "PENDING",
    "notes": []
  },
  "dossier": "corpus/evidence/approche-axiomatique-arrow-raynaud/lecture.json",
  "notes": [
    "Ce que cette carte n'affirme pas, et qui serait le contresens le plus facile : elle ne dit pas que l'approche prolonge le théorème d'impossibilité d'Arrow ni qu'elle en tire les conséquences. Le théorème n'est ni énoncé, ni pris pour prémisse, ni prolongé dans l'article : il apparaît une seule fois, p. 11, dans la phrase qui présente Arrow et son prix Nobel de 1972. Ce qui est repris est la démarche axiomatique elle-même, transportée du problème de la démocratie au problème de gestion, et les axiomes d'Arrow en propre.",
    "Le mécanisme, tel qu'il est sur la page et que le résumé n'a pas la place de porter : deux étapes annoncées p. 11, la structuration des données et la recherche des axiomes. La matrice de surclassement (tableau 2, p. 12) agrège « la somme des poids des critères qui évaluent A comme meilleur que B », et refuse d'agréger l'écart de A à B selon un critère, « car la mesure de cet écart semble trop discutable pour que l'on puisse sérieusement le prendre en compte » (p. 11). Suivent sept axiomes numérotés, de l'axiome 0 (ne juger que sur la matrice, p. 13) à l'axiome 6' (p. 18), et quatre théorèmes p. 16 et 17. Le texte déclare lui-même une incompatibilité entre ses propres axiomes, p. 18 : « Dans le cas général, cet axiome n'est pas compatible avec les axiomes de prudence et d'indépendance. »",
    "L'article ne propose pas un produit, et la carte ne doit pas le laisser croire : la batterie d'axiomes retenue « pourrait sembler souhaitable pour tous les cas possibles, ou bien, être préconisée par Arrow et Raynaud comme étant leur méthode. Ce serait une compréhension erronée de l'approche » (p. 18). Le texte nomme aussi son point faible, p. 20 : la « bibliothèque d'axiomes » n'existe pas encore, et « le décideur gestionnaire ne puisse en général se passer d'un expert qui l'aide à formuler correctement ses axiomes ».",
    "Lacune assumée : un second concept a été vu et n'est pas instruit, le choix prudent. Axiome 4, p. 15, « Le candidat retenu sera un vainqueur prudent », construit par l'ajout d'un critère virtuel de conciliation de poids minimal, illustré p. 15 et 16 par un conseil municipal à trois partis et trois projets, et caractérisé par les quatre théorèmes de Raynaud p. 16 et 17, où le poids minimal donne « une idée de la gravité du conflit entre les critères ». Mécanisme autonome et citable, laissé de côté par plafond de lot.",
    "L'axiome d'indépendance n'est pas instruit ici. Le texte le francise en « indépendance par rapport aux alternatives irrelevantes », le juge « ici inutilement fort » et lui substitue une indépendance dichotomique supérieure (p. 17). C'est le même axiome que celui d'une autre fiche du corpus, sous une autre traduction : cette carte le mentionne comme ce que l'approche modifie, elle n'en fait pas son objet.",
    "L'ouvrage d'Arrow et Raynaud de 1986 n'a pas été ouvert : la page de l'éditeur MIT Press rend HTTP 403 et la notice a été prise sur Open Library. Il figure en source parce qu'il établit la cosignature des deux hommes hors des seules déclarations de l'article, et aucune phrase de cette carte ne porte sur son contenu. Même régime pour le volume français de 2011, connu par sa seule notice BnF.",
    "Deux volumes annoncés « à paraître aux Editions Masson » par l'article ne sont pas portés en source : il les nomme sous deux titres différents (« Choix social et décision multicritère », p. 13 ; « L'approche axiomatisée en décision multicritère », note 5 p. 16), et l'API SRU du catalogue général de la BnF rend zéro notice pour chacun, comme pour Hervé Raynaud croisé avec l'éditeur Masson. Publication non établie.",
    "État d'accès, à ne pas repayer : l'article n'a pas de DOI déposé et se résout par son URL Persée. Le fac-similé est servi page par page en image ; le dérivé _1000 rend HTTP 500 pour cet article, _1400 est le plus grand servi et _2000 renvoie les mêmes octets. Les onze pages 11 à 21 ont été lues sur l'image, aucune sautée, et la citation a été relue sur l'image de la page 13 et non sur l'OCR de Persée.",
    "Citations écartées par le lecteur, avec leur motif, au cas où une reprise les rouvrirait : p. 19, « Pour Arrow et Raynaud, l'obstination de ceux qui prétendent pouvoir appliquer légitimement à tous les cas une panoplie limitée de recettes est vaine » (149 caractères, mais reprise en exergue de marge sur la même page) ; p. 11, « Pour permettre un choix avisé, ils préconisent de s'intéresser aux propriétés logiques de la recette ou règle de décision » (122 caractères, mais « ils » perd son antécédent hors du paragraphe). La phrase retenue p. 13 n'existe que dans le corps du texte et porte la définition du terme pivot."
  ]
}
