{
  "$schema": "../schema/carte.schema.json",
  "id": "quantifier-convenir-et-mesurer",
  "slug": "quantifier-convenir-et-mesurer",
  "status": "VALIDATED",
  "title": "Quantifier : convenir et mesurer",
  "themes": [
    "quantification-operation-sociale"
  ],
  "domain": null,
  "theme_labels": {
    "quantification-operation-sociale": "La quantification comme opération"
  },
  "authors": [
    {
      "name": "Alain Desrosières",
      "app_author_id": null
    }
  ],
  "attribution_note": "Desrosières signe seul le chapitre où la formule a été lue. 2008 est la date du plus ancien de ses textes ouverts où elle se lit, non une date de première formulation établie : il renvoie lui-même en note à un développement publié en 2007, qui n'a pas été retrouvé. La notion de convention d'équivalence qu'il mobilise, il la rattache en note à des travaux antérieurs de Bruno Latour (1984) et de Laurent Thévenot (1983).",
  "hook": "Mesurer suppose la chose déjà mesurable : qu'a-t-on convenu avant de compter ?",
  "summary": "Quantifier ne se réduit pas à mesurer : il faut d'abord établir des conventions d'équivalence, la mesure venant ensuite comme mise en œuvre réglée de ces conventions.",
  "quotation": {
    "text": "De ce point de vue, la quantification se décompose en deux moments : convenir et mesurer.",
    "reference": "Alain Desrosières, « La statistique, outil de gouvernement et outil de preuve. Introduction », chapitre 1 de Pour une sociologie historique de la quantification. L'argument statistique I, Paris, Presses des Mines, 2008, p. 7-20.",
    "locator": "Chapitre 1, section « Quantifier, c'est convenir puis mesurer », § 7",
    "language": "fr",
    "original_text": null,
    "original_language": null,
    "translation": {
      "kind": "none",
      "translator": null,
      "edition": null
    }
  },
  "sources": [
    {
      "label": "Alain Desrosières, Pour une sociologie historique de la quantification. L'argument statistique I, Paris, Presses des Mines, 2008, 329 p. Chapitre 1, p. 7-20. Édition électronique en accès libre sur OpenEdition Books.",
      "kind": "primary",
      "locator": "chap. 1, § 7 (p. 7-20)",
      "doi_isbn": "10.4000/books.pressesmines.909",
      "url": "https://books.openedition.org/pressesmines/909",
      "consulted": "full-text"
    }
  ],
  "review": {
    "reviewer": "contrôle aveugle",
    "date": "2026-08-17",
    "attribution": "confirmee",
    "quotation": "verbatim",
    "sources": "resolvent",
    "prose": "fidele",
    "verdict": "PASS",
    "rounds": 0,
    "notes": [
      "Texte primaire ouvert moi-même : https://books.openedition.org/pressesmines/909 (accès libre, protection anti-bot Anubis franchie, page HTML complète de 333 789 octets, texte extrait 116 291 caractères). La phrase citée s'y lit à l'identique, sans coupe ni variante : « Le verbe quantifier, dans sa forme active (faire du nombre), suppose que soit élaborée et explicitée une série de conventions d'équivalences préalables[3], impliquant des comparaisons, des négociations, des compromis, des traductions, des inscriptions, des codages, des procédures codifiées et réplicables, et des calculs conduisant à la mise en nombre. La mesure proprement dite vient ensuite, comme mise en œuvre réglée de ces conventions. De ce point de vue, la quantification se décompose en deux moments : convenir et mesurer. »",
      "Localisation vérifiée : la phrase clôt le paragraphe numéroté 7 de l'édition OpenEdition, premier paragraphe sous l'intertitre « QUANTIFIER, C'EST CONVENIR PUIS MESURER ». Le locator de la fiche (chap. 1, section « Quantifier, c'est convenir puis mesurer », § 7) est exact. Texte en français d'origine, aucune traduction à déclarer.",
      "ATTRIBUTION. Le chapitre est signé du seul Alain Desrosières (Crossref, api.crossref.org/works/10.4000/books.pressesmines.909 : auteur unique « Alain Desrosières », type book-chapter). Les notes du chapitre que j'ai lues sur place bornent d'elles-mêmes la paternité : la note 2 indique « Ce paragraphe reprend en partie un développement figurant dans un texte publié dans un ouvrage collectif du Centre Cournot (Desrosières 2007), non repris ici » — antériorité de Desrosières sur lui-même, pas d'un tiers ; la note 3 précise que la notion de convention d'équivalence « doit notamment à des travaux déjà anciens de Bruno Latour (1984) dans le supplément Irréductions au livre sur Pasteur, et de Laurent Thévenot (1983) ». La décomposition en deux moments « convenir et mesurer » est bien formulée par Desrosières, l'emprunt déclaré portant sur la notion d'équivalence, non sur la formule. Corroboration tierce ouverte : Christophe Traïni, « Convenir, mesurer, juger », in C. Cournil (dir.), Expertises et argumentaires juridiques, DICE Éditions, 2024, § 27 (https://books.openedition.org/dice/17367), qui cite ce même passage entre guillemets en l'attribuant explicitement à Desrosières.",
      "SOURCES. DOI 10.4000/books.pressesmines.909 résolu par Crossref : « Chapitre 1. La statistique, outil de gouvernement et outil de preuve. Introduction », Alain Desrosières, in Pour une sociologie historique de la quantification, Presses des Mines, Paris, 2008, pages 7-20 — titre, auteur, éditeur, lieu, année et pagination conformes à la fiche. Page du livre ouverte (https://books.openedition.org/pressesmines/901) : « L'Argument statistique I », Presses des Mines, Paris, année d'édition 2008, 329 pages, ISBN imprimé 978-2-35671-002-4, ISBN numérique 978-2-35671-090-1 — les « 329 p. » et la mention d'édition électronique en accès libre sont exactes ; j'ai lu le chapitre intégralement sans authentification.",
      "PROSE. Le hook (« Mesurer suppose la chose déjà mesurable ») reprend sans excès le § 7 : « l'idée de mesure […] implique que quelque chose existe sous une forme déjà mesurable selon une métrologie réaliste, comme la hauteur de la Tour Eiffel ». Le summary est porté mot pour mot par le texte (« conventions d'équivalences préalables » ; « La mesure proprement dite vient ensuite, comme mise en œuvre réglée de ces conventions »). Aucun adjectif ni généralisation qui déborde la source.",
      "Non atteint, déclaré comme tel : web.archive.org a refusé toutes mes requêtes (curl 35, connection reset), je n'ai donc pas de contre-lecture archivée. Le texte de 2007 du Centre Cournot auquel renvoie la note 2 est très probablement A. Desrosières, « Comparer l'incomparable », in J.-P. Touffut (dir.), La société du probable, Albin Michel, 2007 (identification par recherche, non par ouverture du volume) : je ne l'ai pas ouvert et ne peux donc dire si la formule y figure déjà. Cela ne touche aucun des quatre points, la fiche ne revendiquant pas 2008 comme date de première formulation. Recherche HAL sur « convenir et mesurer » : 0 résultat (silence non probant). OpenAlex et Semantic Scholar non interrogés (quota)."
    ]
  },
  "notes": [
    "La formule n'est PAS dans « Les qualités des quantités » (Courrier des statistiques, 105-106, 2003), que le repérage désignait comme source primaire : l'article a été ouvert et converti en texte intégral, le verbe « convenir » n'y figure pas une seule fois. Dix-huit textes de l'auteur auto-archivés sur HAL (1982-2009) ont été fouillés en bloc avec le même résultat. L'article de 2003 n'est donc pas affiché en source : l'y voir inviterait au contresens exact que la lecture a écarté.",
    "Deux formes coexistent sur la même page et sont toutes deux de Desrosières : l'intertitre porte « Quantifier, c'est convenir PUIS mesurer », le corps du texte « deux moments : convenir ET mesurer ». La citation retenue est celle du corps du texte ; la version « puis » est plus explicite sur l'ordre des deux moments, qui est le cœur de l'argument.",
    "L'édition électronique consultée numérote les paragraphes (§ 7 sur 22) mais ne reporte pas la pagination imprimée à l'intérieur du chapitre : le locator donne la section et le paragraphe, plus la pagination du chapitre entier. Le texte a été lu en HTML, non sur un fac-similé de l'imprimé.",
    "La politique des grands nombres (1993) et le second volume, Gouverner par les nombres. L'argument statistique II (2008), n'ont pas été ouverts : rien n'est avancé sur ce qu'ils contiendraient de cette formule."
  ]
}
